student@student-OptiPlex-3050:~$ sudo mysql -u root -p
[sudo] password for student: 
Enter password: 
Welcome to the MariaDB monitor.  Commands end with ; or \g.
Your MariaDB connection id is 34
Server version: 10.0.38-MariaDB-0ubuntu0.16.04.1 Ubuntu 16.04

Copyright (c) 2000, 2018, Oracle, MariaDB Corporation Ab and others.

Type 'help;' or '\h' for help. Type '\c' to clear the current input statement.

MariaDB [(none)]> use student;
Reading table information for completion of table and column names
You can turn off this feature to get a quicker startup with -A

Database changed
MariaDB [student]> select * from emp;
Empty set (0.00 sec)

MariaDB [student]> insert into emp values(1,'Arjun','HR',20000,'1999-05-09',6);
Query OK, 1 row affected (0.04 sec)

MariaDB [student]> select * from emp;
+-------+---------+-------------+--------+------------+-------+
| empno | empname | designation | salary | dob        | depno |
+-------+---------+-------------+--------+------------+-------+
|     1 | Arjun   | HR          |  20000 | 1999-05-09 |     6 |
+-------+---------+-------------+--------+------------+-------+
1 row in set (0.00 sec)

MariaDB [student]> insert into emp values(2,'Arun','Manager',5000,'1995-05-09',6);
Query OK, 1 row affected (0.03 sec)

MariaDB [student]> insert into emp values(3,'Alwin','employee',7000,'1998-06-20',5);
Query OK, 1 row affected (0.03 sec)

MariaDB [student]> insert into emp values(4,'Binoy','Developer',25000,'1997-11-22',4);
Query OK, 1 row affected (0.03 sec)

MariaDB [student]> insert into emp values(5,'sam','Developer',26000,'1995-12-01',5);
Query OK, 1 row affected (0.03 sec)

MariaDB [student]> select * from emp;
+-------+---------+-------------+--------+------------+-------+
| empno | empname | designation | salary | dob        | depno |
+-------+---------+-------------+--------+------------+-------+
|     1 | Arjun   | HR          |  20000 | 1999-05-09 |     6 |
|     2 | Arun    | Manager     |   5000 | 1995-05-09 |     6 |
|     3 | Alwin   | employee    |   7000 | 1998-06-20 |     5 |
|     4 | Binoy   | Developer   |  25000 | 1997-11-22 |     4 |
|     5 | sam     | Developer   |  26000 | 1995-12-01 |     5 |
+-------+---------+-------------+--------+------------+-------+
5 rows in set (0.00 sec)

MariaDB [student]> insert into emp values(6,'Denny','softwareTesting',19000,'1995-09-11',4);
Query OK, 1 row affected, 1 warning (0.03 sec)

MariaDB [student]> select * from emp;
+-------+---------+-------------+--------+------------+-------+
| empno | empname | designation | salary | dob        | depno |
+-------+---------+-------------+--------+------------+-------+
|     1 | Arjun   | HR          |  20000 | 1999-05-09 |     6 |
|     2 | Arun    | Manager     |   5000 | 1995-05-09 |     6 |
|     3 | Alwin   | employee    |   7000 | 1998-06-20 |     5 |
|     4 | Binoy   | Developer   |  25000 | 1997-11-22 |     4 |
|     5 | sam     | Developer   |  26000 | 1995-12-01 |     5 |
|     6 | Denny   | softwareTe  |  19000 | 1995-09-11 |     4 |
+-------+---------+-------------+--------+------------+-------+
6 rows in set (0.00 sec)

MariaDB [student]> select * from emp where salary>10000;
+-------+---------+-------------+--------+------------+-------+
| empno | empname | designation | salary | dob        | depno |
+-------+---------+-------------+--------+------------+-------+
|     1 | Arjun   | HR          |  20000 | 1999-05-09 |     6 |
|     4 | Binoy   | Developer   |  25000 | 1997-11-22 |     4 |
|     5 | sam     | Developer   |  26000 | 1995-12-01 |     5 |
|     6 | Denny   | softwareTe  |  19000 | 1995-09-11 |     4 |
+-------+---------+-------------+--------+------------+-------+
4 rows in set (0.00 sec)

MariaDB [student]> dlete * from emp where depno=6;
ERROR 1064 (42000): You have an error in your SQL syntax; check the manual that corresponds to your MariaDB server version for the right syntax to use near 'dlete * from emp where depno=6' at line 1
MariaDB [student]> delete * from emp where depno=6;
ERROR 1064 (42000): You have an error in your SQL syntax; check the manual that corresponds to your MariaDB server version for the right syntax to use near '* from emp where depno=6' at line 1
MariaDB [student]> delete * from emp where depno='6';
ERROR 1064 (42000): You have an error in your SQL syntax; check the manual that corresponds to your MariaDB server version for the right syntax to use near '* from emp where depno='6'' at line 1
MariaDB [student]> delete from emp where depno=6;
Query OK, 2 rows affected (0.04 sec)

MariaDB [student]> select * from emp;
+-------+---------+-------------+--------+------------+-------+
| empno | empname | designation | salary | dob        | depno |
+-------+---------+-------------+--------+------------+-------+
|     3 | Alwin   | employee    |   7000 | 1998-06-20 |     5 |
|     4 | Binoy   | Developer   |  25000 | 1997-11-22 |     4 |
|     5 | sam     | Developer   |  26000 | 1995-12-01 |     5 |
|     6 | Denny   | softwareTe  |  19000 | 1995-09-11 |     4 |
+-------+---------+-------------+--------+------------+-------+
4 rows in set (0.00 sec)

MariaDB [student]> insert into emp values(7,'Joy','manager',15000,'1995-08-21',4);
Query OK, 1 row affected (0.04 sec)

MariaDB [student]> alter table emp modify column salary where designation='manager';
ERROR 1064 (42000): You have an error in your SQL syntax; check the manual that corresponds to your MariaDB server version for the right syntax to use near 'where designation='manager'' at line 1
MariaDB [student]> alter table emp modify column salary where designation=manager;
ERROR 1064 (42000): You have an error in your SQL syntax; check the manual that corresponds to your MariaDB server version for the right syntax to use near 'where designation=manager' at line 1
MariaDB [student]> alter table emp modify  salary where designation=manager;
ERROR 1064 (42000): You have an error in your SQL syntax; check the manual that corresponds to your MariaDB server version for the right syntax to use near 'where designation=manager' at line 1
MariaDB [student]> alter table emp modify salary where designation='manager';
ERROR 1064 (42000): You have an error in your SQL syntax; check the manual that corresponds to your MariaDB server version for the right syntax to use near 'where designation='manager'' at line 1
MariaDB [student]> alter table emp modify salary=5000 where designation=manager;
ERROR 1064 (42000): You have an error in your SQL syntax; check the manual that corresponds to your MariaDB server version for the right syntax to use near '=5000 where designation=manager' at line 1
MariaDB [student]> update emp set salary=salary+5000 where designation=manager;
ERROR 1054 (42S22): Unknown column 'manager' in 'where clause'
MariaDB [student]> update emp set salary=salary+5000 where designation='manager';
Query OK, 1 row affected (0.05 sec)
Rows matched: 1  Changed: 1  Warnings: 0

MariaDB [student]> select * from emp;
+-------+---------+-------------+--------+------------+-------+
| empno | empname | designation | salary | dob        | depno |
+-------+---------+-------------+--------+------------+-------+
|     3 | Alwin   | employee    |   7000 | 1998-06-20 |     5 |
|     4 | Binoy   | Developer   |  25000 | 1997-11-22 |     4 |
|     5 | sam     | Developer   |  26000 | 1995-12-01 |     5 |
|     6 | Denny   | softwareTe  |  19000 | 1995-09-11 |     4 |
|     7 | Joy     | manager     |  20000 | 1995-08-21 |     4 |
+-------+---------+-------------+--------+------------+-------+
5 rows in set (0.00 sec)

MariaDB [student]> select empname from emp in desc;
ERROR 1064 (42000): You have an error in your SQL syntax; check the manual that corresponds to your MariaDB server version for the right syntax to use near 'in desc' at line 1
MariaDB [student]> select from emp where empname=desc;
ERROR 1064 (42000): You have an error in your SQL syntax; check the manual that corresponds to your MariaDB server version for the right syntax to use near 'from emp where empname=desc' at line 1
MariaDB [student]> select empname from emp order by empname desc;
+---------+
| empname |
+---------+
| sam     |
| Joy     |
| Denny   |
| Binoy   |
| Alwin   |
+---------+
5 rows in set (0.00 sec)

MariaDB [student]> select empname from emp order by empname;
+---------+
| empname |
+---------+
| Alwin   |
| Binoy   |
| Denny   |
| Joy     |
| sam     |
+---------+
5 rows in set (0.00 sec)

MariaDB [student]> truncate table emp;
Query OK, 0 rows affected (0.19 sec)

MariaDB [student]> select * from emp;
Empty set (0.00 sec)

MariaDB [student]> truncate emp;
Query OK, 0 rows affected (0.18 sec)

MariaDB [student]> select * from emp;
Empty set (0.00 sec)

MariaDB [student]> Ctrl-C -- exit!
Aborted
student@student-OptiPlex-3050:~$ 

